{"manifest_version":"2.2.0","version_id":"ver_4d71960ccd32f56cef2a1e2c6edb82be34e1e7c154b4ba4f61e6dc6d18f0c387","document_id":"doc_x655ctkrq7d1qhgpprc0y8fbmq","principal_id":"aaaaaaaaaaaaaaaaaaaaaaaaaaaaaaaaaaaaaaaaaaaaaaaaaaaaaaaaaaaaaaaa","collection":"nanolime","state":"ACTIVE","original_file_sha256":"bf629d4b425db4e842e66a5ed2304a334ca51a6b2ed45b2986517cfa6ec6c7ae","normalized_source_sha256":"aaaaaaaaaaaaaaaaaaaaaaaaaaaaaaaaaaaaaaaaaaaaaaaaaaaaaaaaaaaaaaaa","source_receipt_id":"sr_0qx6fnk7aez2awdfvm566q6m92","reviewed_ficha_linkage_state":"pending_canonical_evidence","extraction":{"schema_version":"docling-json-v1","docling_version":"fixture","option_digest":"aaaaaaaaaaaaaaaaaaaaaaaaaaaaaaaaaaaaaaaaaaaaaaaaaaaaaaaaaaaaaaaa"},"tokenizer":{"name":"bge-m3","revision":"fixture"},"embedding":{"model":"bge-m3","revision":"fixture"},"identity_rules":{"version":"sha256(logical_document_id, normalized_source_sha256, extraction_schema, docling_version, docling_option_digest, tokenizer_revision, embedding_revision)","item":"sha256(version_id, item_type, page_index, canonical_coordinates, stable_structure_path)","point":"sha256(item_id, chunk_ordinal)"},"coordinate_system":{"page_index_base":0,"rotation_applied":true,"origin":"top-left","units":"points","page_dimensions":[{"page_index":0,"width":595,"height":842}]},"integrity":{"qdrant_point_count":0,"gridfs_asset_count":0,"projection_count":0,"table_structure_digest":"aaaaaaaaaaaaaaaaaaaaaaaaaaaaaaaaaaaaaaaaaaaaaaaaaaaaaaaaaaaaaaaa","crop_digest":"aaaaaaaaaaaaaaaaaaaaaaaaaaaaaaaaaaaaaaaaaaaaaaaaaaaaaaaaaaaaaaaa","content_digest":"aaaaaaaaaaaaaaaaaaaaaaaaaaaaaaaaaaaaaaaaaaaaaaaaaaaaaaaaaaaaaaaa","asset_references":[],"integrity_digest":"aaaaaaaaaaaaaaaaaaaaaaaaaaaaaaaaaaaaaaaaaaaaaaaaaaaaaaaaaaaaaaaa"},"validation":{"result":"passed","warnings":[]},"trace_id":"trace_td9g7985esqxyezqe6wfc8m176","fencing_token":1,"created_at":"2026-08-31T00:00:00Z","original_filename":"assay-source.pdf"}
